<?xml version="1.0" encoding="UTF-8"?>
<Monument xmlns:xsi="http://www.w3.org/2001/XMLSchema-instance" 
xsi:noNamespaceSchemaLocation="../src/main/resources/templates/Monument.xsd">
   <id>154</id>
   <nom>Heri es Souani</nom>
   <description>Meknes Morocco</description>
   <coordinate>
      <latitude>33.880245</latitude>
      <longitude>-5.557978</longitude>
   </coordinate>
   <liensImage>
      <liensImage>https://media-cdn.tripadvisor.com/media/photo-o/0d/c3/f3/a1/granary.jpg</liensImage>
   </liensImage>
   <ville>
      <nom>Meknes</nom>
      <description>Meknes</description>
   </ville>
   <evaluations/>
   <rating>4.0</rating>
</Monument>