<?xml version="1.0" encoding="UTF-8"?>
<Monument xmlns:xsi="http://www.w3.org/2001/XMLSchema-instance" 
xsi:noNamespaceSchemaLocation="../src/main/resources/templates/Monument.xsd">
   <id>90</id>
   <nom>Tanneries of Tetouan</nom>
   <description>Rue Laayoun close to Bab Mkabar, Tetouan Morocco</description>
   <coordinate>
      <latitude>35.75073</latitude>
      <longitude>-5.82909</longitude>
   </coordinate>
   <liensImage>
      <liensImage>https://media-cdn.tripadvisor.com/media/photo-w/17/31/cc/83/tanneries-of-tetouan.jpg</liensImage>
   </liensImage>
   <ville>
      <nom>Tetouan</nom>
      <description>Tetouan</description>
   </ville>
   <evaluations/>
   <rating>4.5</rating>
</Monument>