<?xml version="1.0" encoding="UTF-8"?>
<Monument xmlns:xsi="http://www.w3.org/2001/XMLSchema-instance" 
xsi:noNamespaceSchemaLocation="../src/main/resources/templates/Monument.xsd">
   <id>47</id>
   <nom>Borj Nord</nom>
   <description>Avenue des Merinides, Fes 30030 Morocco</description>
   <coordinate>
      <latitude>34.07234</latitude>
      <longitude>-4.98142</longitude>
   </coordinate>
   <liensImage>
      <liensImage>https://media-cdn.tripadvisor.com/media/photo-m/1280/16/2a/90/01/borj-nord.jpg</liensImage>
   </liensImage>
   <ville>
      <nom>Fes</nom>
      <description>Fes</description>
   </ville>
   <evaluations/>
   <rating>4.0</rating>
</Monument>