<?xml version="1.0" encoding="UTF-8"?>
<Monument xmlns:xsi="http://www.w3.org/2001/XMLSchema-instance" 
xsi:noNamespaceSchemaLocation="../src/main/resources/templates/Monument.xsd">
   <id>7</id>
   <nom>The Corniche</nom>
   <description>Boulevard de la Corniche, Casablanca 20000 Morocco</description>
   <coordinate>
      <latitude>33.596264</latitude>
      <longitude>-7.674186</longitude>
   </coordinate>
   <liensImage>
      <liensImage>https://media-cdn.tripadvisor.com/media/photo-o/0e/35/43/93/schones-restaurant.jpg</liensImage>
   </liensImage>
   <ville>
      <nom>Casablanca</nom>
      <description>Casablanca</description>
   </ville>
   <evaluations/>
   <rating>4.0</rating>
</Monument>