<?xml version="1.0" encoding="UTF-8"?>
<Monument xmlns:xsi="http://www.w3.org/2001/XMLSchema-instance" 
xsi:noNamespaceSchemaLocation="../src/main/resources/templates/Monument.xsd">
   <id>132</id>
   <nom>Plage de Rabat</nom>
   <description>Rabat Morocco</description>
   <coordinate>
      <latitude>34.032967</latitude>
      <longitude>-6.835805</longitude>
   </coordinate>
   <liensImage>
      <liensImage>https://media-cdn.tripadvisor.com/media/photo-o/11/ec/4d/3c/img-20180127-132337802.jpg</liensImage>
   </liensImage>
   <ville>
      <nom>Rabat</nom>
      <description>Rabat</description>
   </ville>
   <evaluations/>
   <rating>3.0</rating>
</Monument>