<?xml version="1.0" encoding="UTF-8"?>
<Monument xmlns:xsi="http://www.w3.org/2001/XMLSchema-instance" 
xsi:noNamespaceSchemaLocation="../src/main/resources/templates/Monument.xsd">
   <id>174</id>
   <nom>Dome Sir Son Isa</nom>
   <description>Meknes Morocco</description>
   <coordinate>
      <latitude>33.89913</latitude>
      <longitude>-5.570492</longitude>
   </coordinate>
   <liensImage>
      <liensImage>https://media-cdn.tripadvisor.com/media/photo-m/1280/1b/33/f3/b9/dome-sir-son-isa.jpg</liensImage>
   </liensImage>
   <ville>
      <nom>Meknes</nom>
      <description>Meknes</description>
   </ville>
   <evaluations/>
   <rating>3.0</rating>
</Monument>