<?xml version="1.0" encoding="UTF-8"?>
<Monument xmlns:xsi="http://www.w3.org/2001/XMLSchema-instance" 
xsi:noNamespaceSchemaLocation="../src/main/resources/templates/Monument.xsd">
   <id>273</id>
   <nom>Modern Art Center of Tetouan</nom>
   <description>S/N, Avenue Al Massira, Tetouan 93000 Morocco</description>
   <coordinate>
      <latitude>35.57693</latitude>
      <longitude>-5.37273</longitude>
   </coordinate>
   <liensImage>
      <liensImage>https://media-cdn.tripadvisor.com/media/photo-o/06/80/74/04/the-tetouan-centre-of.jpg</liensImage>
   </liensImage>
   <ville>
      <nom>Tetouan</nom>
      <description>Tetouan</description>
   </ville>
   <evaluations/>
   <rating>4.0</rating>
</Monument>