<?xml version="1.0" encoding="UTF-8"?>
<Monument xmlns:xsi="http://www.w3.org/2001/XMLSchema-instance" 
xsi:noNamespaceSchemaLocation="../src/main/resources/templates/Monument.xsd">
   <id>50</id>
   <nom>Palais El Mokri</nom>
   <description>34, Palais Elmokri, Ziat, Fes 30000 Morocco</description>
   <coordinate>
      <latitude>34.04199</latitude>
      <longitude>-5.00867</longitude>
   </coordinate>
   <liensImage>
      <liensImage>https://media-cdn.tripadvisor.com/media/photo-o/13/c6/6e/30/20180617-132857-largejpg.jpg</liensImage>
   </liensImage>
   <ville>
      <nom>Fes</nom>
      <description>Fes</description>
   </ville>
   <evaluations/>
   <rating>4.5</rating>
</Monument>