<?xml version="1.0" encoding="UTF-8"?>
<Monument xmlns:xsi="http://www.w3.org/2001/XMLSchema-instance" 
xsi:noNamespaceSchemaLocation="../src/main/resources/templates/Monument.xsd">
   <id>105</id>
   <nom>Marrakech Train Station</nom>
   <description>Hasan II Avenue, Marrakech 40050 Morocco</description>
   <coordinate>
      <latitude>31.63376</latitude>
      <longitude>-8.0021</longitude>
   </coordinate>
   <liensImage>
      <liensImage>https://media-cdn.tripadvisor.com/media/photo-o/07/67/25/6d/station-marrakesh.jpg</liensImage>
   </liensImage>
   <ville>
      <nom>Marrakech</nom>
      <description>Marrakech</description>
   </ville>
   <evaluations/>
   <rating>4.5</rating>
</Monument>