<?xml version="1.0" encoding="UTF-8"?>
<Monument xmlns:xsi="http://www.w3.org/2001/XMLSchema-instance" 
xsi:noNamespaceSchemaLocation="../src/main/resources/templates/Monument.xsd">
   <id>2</id>
   <nom>ONCF</nom>
   <description>Marrakech Morocco</description>
   <coordinate>
      <latitude>33.59016</latitude>
      <longitude>-7.590017</longitude>
   </coordinate>
   <liensImage>
      <liensImage>https://media-cdn.tripadvisor.com/media/photo-o/09/f9/e1/83/oncf.jpg</liensImage>
   </liensImage>
   <ville>
      <nom>Marrakech</nom>
      <description>Marrakech</description>
   </ville>
   <evaluations/>
   <rating>3.0</rating>
</Monument>