<?xml version="1.0" encoding="UTF-8"?>
<Monument xmlns:xsi="http://www.w3.org/2001/XMLSchema-instance" 
xsi:noNamespaceSchemaLocation="../src/main/resources/templates/Monument.xsd">
   <id>63</id>
   <nom>Tangier Casbah</nom>
   <description>Place de la Kasbah, Tangier 90000 Morocco</description>
   <coordinate>
      <latitude>35.75073</latitude>
      <longitude>-5.82909</longitude>
   </coordinate>
   <liensImage>
      <liensImage>https://media-cdn.tripadvisor.com/media/photo-o/17/10/b1/d4/tangier-casbah.jpg</liensImage>
   </liensImage>
   <ville>
      <nom>Tangier</nom>
      <description>Tangier</description>
   </ville>
   <evaluations/>
   <rating>4.0</rating>
</Monument>