<?xml version="1.0" encoding="UTF-8"?>
<Monument xmlns:xsi="http://www.w3.org/2001/XMLSchema-instance" 
xsi:noNamespaceSchemaLocation="../src/main/resources/templates/Monument.xsd">
   <id>135</id>
   <nom>La Villa des Arts</nom>
   <description>10 Rue Beni Mellal, Angle Avenue, Rabat 10030 Morocco</description>
   <coordinate>
      <latitude>34.01272</latitude>
      <longitude>-6.830622</longitude>
   </coordinate>
   <liensImage>
      <liensImage>https://media-cdn.tripadvisor.com/media/photo-o/0b/7e/45/3b/villa-des-arts-front.jpg</liensImage>
   </liensImage>
   <ville>
      <nom>Rabat</nom>
      <description>Rabat</description>
   </ville>
   <evaluations/>
   <rating>4.5</rating>
</Monument>