<?xml version="1.0" encoding="UTF-8"?>
<Monument xmlns:xsi="http://www.w3.org/2001/XMLSchema-instance" 
xsi:noNamespaceSchemaLocation="../src/main/resources/templates/Monument.xsd">
   <id>68</id>
   <nom>Feddan Park Tetouan</nom>
   <description>Avenue Alger, Tetouan Morocco</description>
   <coordinate>
      <latitude>35.77443</latitude>
      <longitude>-5.80819</longitude>
   </coordinate>
   <liensImage>
      <liensImage>https://media-cdn.tripadvisor.com/media/photo-m/1280/15/04/bb/07/feddan-park-tetouan.jpg</liensImage>
   </liensImage>
   <ville>
      <nom>Tetouan</nom>
      <description>Tetouan</description>
   </ville>
   <evaluations/>
   <rating>4.5</rating>
</Monument>