<?xml version="1.0" encoding="UTF-8"?>
<Monument xmlns:xsi="http://www.w3.org/2001/XMLSchema-instance" 
xsi:noNamespaceSchemaLocation="../src/main/resources/templates/Monument.xsd">
   <id>52</id>
   <nom>Dar Batha Museum</nom>
   <description>Place du Batha Fez, Fes 30030 Morocco</description>
   <coordinate>
      <latitude>34.060474</latitude>
      <longitude>-4.98324</longitude>
   </coordinate>
   <liensImage>
      <liensImage>https://media-cdn.tripadvisor.com/media/photo-o/0a/52/d0/de/photo2jpg.jpg</liensImage>
   </liensImage>
   <ville>
      <nom>Fes</nom>
      <description>Fes</description>
   </ville>
   <evaluations/>
   <rating>3.5</rating>
</Monument>