<?xml version="1.0" encoding="UTF-8"?>
<Monument xmlns:xsi="http://www.w3.org/2001/XMLSchema-instance" 
xsi:noNamespaceSchemaLocation="../src/main/resources/templates/Monument.xsd">
   <id>228</id>
   <nom>Memoire d'Agadir</nom>
   <description>Ave du President Kennedy &amp; Ave des Far, Agadir Morocco</description>
   <coordinate>
      <latitude>30.424723</latitude>
      <longitude>-9.598011</longitude>
   </coordinate>
   <liensImage>
      <liensImage>https://media-cdn.tripadvisor.com/media/photo-o/0a/66/59/af/photo1jpg.jpg</liensImage>
   </liensImage>
   <ville>
      <nom>Agadir</nom>
      <description>Agadir</description>
   </ville>
   <evaluations/>
   <rating>4.0</rating>
</Monument>